{
  "$schema": "https://json-schema.org/draft/2020-12/schema",
  "$id": "https://contracts.mia.local/mvp/v1/plugin-manifest.schema.json",
  "title": "MIA MVP v1 plugin manifest (mia.json)",
  "description": "Plugin envelope, Review §5.4.3-§5.4.4, ADR-0010. The executable part is an MCP server, UI is MCP Apps (ui://), instructions are SKILL.md. Field names are camelCase like the Review example and MCP; API payloads elsewhere in mvp/v1 are snake_case.",
  "type": "object",
  "additionalProperties": false,
  "required": ["schemaVersion", "id", "version", "name", "listing", "server", "tools", "permissions"],
  "properties": {
    "schemaVersion": { "const": "mia.plugin/1" },
    "id": { "$ref": "common.schema.json#/$defs/pluginId" },
    "version": {
      "type": "string",
      "pattern": "^(0|[1-9][0-9]*)\\.(0|[1-9][0-9]*)\\.(0|[1-9][0-9]*)(-[0-9A-Za-z.-]+)?$"
    },
    "name": { "type": "string", "minLength": 2, "maxLength": 60 },
    "listing": { "$ref": "#/$defs/listing" },
    "server": {
      "oneOf": [
        { "$ref": "#/$defs/builtinServer" },
        { "$ref": "#/$defs/remoteServer" },
        { "$ref": "#/$defs/declarativeServer" }
      ]
    },
    "skills": {
      "type": "array",
      "maxItems": 8,
      "items": { "$ref": "#/$defs/relativePath" },
      "description": "Paths of SKILL.md files inside the plugin package. Only their description goes into the system prompt; the body is loaded when the plugin is selected"
    },
    "tools": {
      "type": "object",
      "minProperties": 1,
      "maxProperties": 96,
      "propertyNames": { "$ref": "common.schema.json#/$defs/toolName" },
      "additionalProperties": { "$ref": "#/$defs/toolPolicy" },
      "description": "Mia policy overlay for the server's tools. Publication checks that this set equals the server's tools/list. At most 96 tools: one model request carries at most 128 tools and 32 are reserved for core and device tools (M15-R1)"
    },
    "requires": {
      "type": "object",
      "additionalProperties": false,
      "properties": {
        "deviceTools": {
          "type": "array",
          "uniqueItems": true,
          "items": { "$ref": "device-tools.schema.json#/$defs/deviceToolName" },
          "description": "Device tools the plugin's flows rely on (e.g. telegram.handoff). Missing tools degrade the plugin, they do not block install"
        },
        "deviceCapabilities": {
          "type": "array",
          "maxItems": 16,
          "items": { "$ref": "device-access.schema.json#/$defs/ManifestDeviceCapability" },
          "description": "M70 (ADR-0016 §9): device capabilities the plugin may use on request, with a user-facing line each. Listed on the consent screen and in the store's «Где работает» block (M72)"
        }
      }
    },
    "whereItRuns": {
      "type": "object",
      "additionalProperties": false,
      "required": ["cloud"],
      "description": "M72: where the plugin works, in the user's words, for the store's «Где работает» block. Absent: the store derives the cloud line from server.kind. Device capabilities come from requires.deviceCapabilities",
      "properties": {
        "cloud": { "type": "string", "minLength": 5, "maxLength": 200, "description": "What runs in the Mia cloud, e.g. «Будильники хранятся и срабатывают на сервере Mia»" },
        "device": { "type": "string", "minLength": 5, "maxLength": 200, "description": "What may run on the phone, only by request and with consent (ADR-0016); omit when nothing does" }
      }
    },
    "surfaces": {
      "type": "object",
      "additionalProperties": false,
      "properties": {
        "tiles": {
          "type": "array",
          "maxItems": 8,
          "items": { "$ref": "#/$defs/tile" }
        }
      }
    },
    "permissions": { "$ref": "#/$defs/permissions" }
  },
  "allOf": [
    {
      "if": {
        "properties": { "server": { "properties": { "kind": { "const": "remote" } } } }
      },
      "then": {
        "properties": { "permissions": { "properties": { "network": { "minItems": 1 } } } }
      }
    }
  ],
  "$defs": {
    "relativePath": {
      "type": "string",
      "pattern": "^(?!/)(?!.*\\.\\.)[A-Za-z0-9._/-]{1,200}$"
    },
    "hostname": {
      "type": "string",
      "pattern": "^(?=.{1,253}$)([a-z0-9]([a-z0-9-]{0,61}[a-z0-9])?\\.)+[a-z]{2,63}$"
    },
    "listing": {
      "type": "object",
      "additionalProperties": false,
      "required": ["description", "category"],
      "properties": {
        "description": { "type": "string", "minLength": 10, "maxLength": 240 },
        "category": {
          "type": "string",
          "enum": ["work", "productivity", "communication", "knowledge", "home", "utilities", "fun"]
        },
        "author": { "type": "string", "minLength": 1, "maxLength": 60 },
        "icon": { "$ref": "#/$defs/relativePath" },
        "screenshots": {
          "type": "array",
          "maxItems": 8,
          "items": { "$ref": "#/$defs/relativePath" }
        },
        "downloads": {
          "type": "array",
          "maxItems": 4,
          "items": {
            "type": "object",
            "additionalProperties": false,
            "required": ["platform", "url", "label"],
            "properties": {
              "platform": { "type": "string", "enum": ["web", "android", "ios", "desktop"] },
              "url": { "$ref": "common.schema.json#/$defs/httpsUrl" },
              "label": { "type": "string", "minLength": 1, "maxLength": 60 }
            }
          }
        }
      }
    },
    "builtinServer": {
      "type": "object",
      "additionalProperties": false,
      "required": ["kind", "module"],
      "description": "Python MCP server running in the core process",
      "properties": {
        "kind": { "const": "builtin" },
        "module": {
          "type": "string",
          "pattern": "^app(\\.[a-z_][a-z0-9_]*)+$",
          "description": "Importable module that exposes the in-process MCP server"
        }
      }
    },
    "remoteServer": {
      "type": "object",
      "additionalProperties": false,
      "required": ["kind", "url", "auth"],
      "description": "Streamable HTTP MCP server (spec 2026-07-28). The URL host must be in permissions.network (SSRF allow-list)",
      "properties": {
        "kind": { "const": "remote" },
        "url": { "$ref": "common.schema.json#/$defs/httpsUrl" },
        "auth": { "type": "string", "enum": ["none", "oauth", "mia_token"] },
        "protocolVersion": { "type": "string", "pattern": "^[0-9]{4}-[0-9]{2}-[0-9]{2}$" },
        "clientId": {
          "type": "string",
          "format": "uri",
          "maxLength": 255,
          "pattern": "^https?://",
          "description": "auth mia_token only (required there): the app's OAuth client_id at Mia, i.e. the https URL of its Client ID Metadata Document. Mia mints the plugin's tokens from the user's grant of this client (5 min, openid, audience = url). Publication requires https and a host in permissions.network (http loopback only with OAUTH_ALLOW_LOOPBACK_CLIENTS)"
        }
      }
    },
    "declarativeServer": {
      "type": "object",
      "additionalProperties": false,
      "required": ["kind", "actions", "view"],
      "description": "No-code plugin (v2-style actions) for which Mia itself is the MCP server; actions become tools, the view becomes an MCP App",
      "properties": {
        "kind": { "const": "declarative" },
        "actions": {
          "type": "array",
          "minItems": 1,
          "maxItems": 10,
          "items": { "$ref": "#/$defs/declarativeAction" }
        },
        "view": {
          "type": "object",
          "additionalProperties": false,
          "required": ["type"],
          "properties": {
            "type": { "type": "string", "enum": ["fields", "html"] },
            "fields": { "type": "array", "maxItems": 10, "items": { "type": "string" } },
            "html": { "type": "string", "maxLength": 24000 }
          }
        }
      }
    },
    "declarativeAction": {
      "type": "object",
      "additionalProperties": false,
      "required": ["name", "description", "inputs", "effect"],
      "properties": {
        "name": { "$ref": "common.schema.json#/$defs/toolName" },
        "description": { "type": "string", "minLength": 5, "maxLength": 300 },
        "inputs": {
          "type": "object",
          "propertyNames": { "pattern": "^[a-z][a-z0-9_]{0,31}$" },
          "additionalProperties": {
            "type": "object",
            "additionalProperties": false,
            "required": ["type"],
            "properties": {
              "type": { "type": "string", "enum": ["string", "integer", "boolean"] },
              "description": { "type": "string", "maxLength": 300 },
              "maxLength": { "type": "integer", "minimum": 1, "maximum": 16000 },
              "minimum": { "type": "integer" },
              "maximum": { "type": "integer" }
            }
          }
        },
        "effect": { "type": "string", "enum": ["state.patch", "model.prompt"] },
        "prompt": { "type": "string", "maxLength": 8000 }
      }
    },
    "toolPolicy": {
      "type": "object",
      "additionalProperties": false,
      "required": ["risk"],
      "properties": {
        "risk": { "$ref": "common.schema.json#/$defs/risk" },
        "voice": {
          "type": "boolean",
          "default": false,
          "description": "Exposed in the voice profile (fast reads only)"
        },
        "timeoutSeconds": { "type": "integer", "minimum": 1, "maximum": 300 },
        "task": {
          "type": "boolean",
          "default": false,
          "description": "Long-running MCP Task; the router wraps it in a job"
        }
      }
    },
    "tile": {
      "type": "object",
      "additionalProperties": false,
      "required": ["id", "resourceUri", "sizes"],
      "properties": {
        "id": { "type": "string", "pattern": "^[a-z][a-z0-9-]{0,47}$" },
        "title": { "type": "string", "minLength": 1, "maxLength": 60 },
        "resourceUri": { "$ref": "common.schema.json#/$defs/uiResourceUri" },
        "bundled": {
          "$ref": "#/$defs/relativePath",
          "description": "HTML shipped with the plugin and served by Mia as the ui:// resource (own UI on top of a third-party server)"
        },
        "sizes": {
          "type": "array",
          "minItems": 1,
          "uniqueItems": true,
          "items": { "type": "string", "enum": ["1x1", "2x1", "2x2", "4x2", "4x4"] }
        },
        "mobile": { "type": "string", "enum": ["card", "tile", "hidden"], "default": "card" },
        "refresh": {
          "type": "object",
          "additionalProperties": false,
          "required": ["tool", "everySeconds"],
          "properties": {
            "tool": { "$ref": "common.schema.json#/$defs/toolName" },
            "everySeconds": { "type": "integer", "minimum": 30, "maximum": 86400 }
          }
        }
      }
    },
    "permissions": {
      "type": "object",
      "additionalProperties": false,
      "required": ["network", "llm", "memory", "notify"],
      "properties": {
        "network": {
          "type": "array",
          "maxItems": 16,
          "uniqueItems": true,
          "items": { "$ref": "#/$defs/hostname" },
          "description": "Allow-listed hosts; private and loopback addresses are always refused in the cloud"
        },
        "llm": {
          "type": "object",
          "additionalProperties": false,
          "required": ["viaHost"],
          "properties": {
            "viaHost": {
              "type": "boolean",
              "description": "The plugin may call the user's model through Mia (llm.generate), within a user-set budget"
            },
            "monthlyBudgetUsd": { "type": "number", "minimum": 0, "maximum": 1000 }
          }
        },
        "memory": {
          "type": "array",
          "uniqueItems": true,
          "items": {
            "type": "string",
            "pattern": "^(context|suggest|read:(profile|work|home|health|finance|interests|other))$"
          },
          "description": "Memory access, same vocabulary as app scopes without the memory. prefix"
        },
        "notify": { "type": "boolean" },
        "schedules": { "type": "boolean", "default": false },
        "publicWeb": {
          "type": "boolean",
          "default": false,
          "description": "The plugin may read any public HTTPS page (builtin plugins only; private and loopback addresses stay refused). Shown on the consent screen as grant network.public_web"
        }
      }
    }
  }
}
