{
  "schemaVersion": "mia.plugin/1",
  "id": "builtin.telegram",
  "version": "1.0.0",
  "name": "Telegram",
  "listing": {
    "description": "Напишите человеку в Telegram голосом: Mia откроет чат с готовым текстом, а вы нажмёте «Отправить». Бот Mia присылает результаты фоновых задач",
    "category": "communication",
    "author": "Mia"
  },
  "server": {
    "kind": "builtin",
    "module": "app.plugins.builtin.telegram.server"
  },
  "skills": [
    "SKILL.md"
  ],
  "tools": {
    "send_message": {
      "risk": "write_external",
      "voice": true,
      "timeoutSeconds": 45
    },
    "connect_bot": {
      "risk": "write_reversible",
      "timeoutSeconds": 10
    }
  },
  "requires": {
    "deviceTools": [
      "telegram.handoff"
    ],
    "deviceCapabilities": [
      {
        "capability": "telegram.draft",
        "description": "По вашей просьбе открывает Telegram на телефоне с готовым текстом; отправляете вы сами",
        "optional": false
      }
    ]
  },
  "whereItRuns": {
    "cloud": "Бот Mia присылает результаты фоновых задач в Telegram из облака.",
    "device": "Сообщение человеку готовится на телефоне: Mia открывает чат с готовым текстом, а отправляете его вы сами."
  },
  "permissions": {
    "network": [],
    "llm": {
      "viaHost": false
    },
    "memory": [],
    "notify": false
  }
}
